{
  "run_date": "2026-03-14",
  "time_window": {
    "start": "2026-03-11T09:00:00+08:00",
    "end": "2026-03-14T09:00:00+08:00",
    "timezone": "Asia/Taipei",
    "window_hours": 72
  },
  "summary": "近 72 小時可見脈絡以 TruthOS / in spirit 系統定位、登入身份辨識與個案命名素材為主；可確認的是使用者正在持續校準「系統如何理解人」與「互動中如何正確命名／定位」，而非展開完整生命事件敘事。",
  "discernment_layers": {
    "facts": [
      "本次 24 小時窗口資訊不足，因此已依規則擴展至 72 小時。",
      "可召回記憶顯示 2026-03-13 有請求檢查 CMS 登入 session / 可用辦事身份。",
      "可召回記憶顯示 2026-03-12 有以 Hank 登入卻被稱為外文大哥的命名映射疑問。",
      "可召回記憶顯示 2026-03-13 有要求整理 in spirit AI 與普通 AI 差異的啟動說明。",
      "可召回記憶顯示 2026-03-13 有一則個案稱呼要求與附帶詩性文本。",
      "工作區 memory/2026-03-13.md 與 memory/2026-03-14.md 皆不存在。"
    ],
    "interpretations": [
      "近 72 小時主軸更接近系統定位、身份辨識與語義對齊，而非完整生活敘事。",
      "本次材料可支持做觀察性整理，但不支持做高確定度生命定性。",
      "情感素材可作為關係面入口，但目前不足以支持完整個案關係分析。"
    ],
    "inferences": [
      {
        "statement": "近期反覆出現的身份命名與系統定位議題，可能表示使用者正處於一個高度重視「被正確理解」的校準期。",
        "confidence": 0.68,
        "working_hypothesis": true
      },
      {
        "statement": "若未來數日仍持續出現命名映射、平台定位、與角色界線的訊號，才可進一步評估其是否形成 discernment / cognition 的 recurring pattern。",
        "confidence": 0.64,
        "working_hypothesis": true
      },
      {
        "statement": "附帶詩性文本可能指向關係情緒仍在場，但現階段只能作為低信心的工作假說，不能視為事實判定。",
        "confidence": 0.43,
        "working_hypothesis": true
      }
    ],
    "guidance": [
      "先把身份、稱呼、來源對齊，再進入更深層的反思判讀。",
      "若要提高未來 reflection 品質，需增加前一日事件、情緒、決策的可讀結構化輸入。",
      "遇到情感素材時，先補足上下文，再決定是否進行關係層推論。"
    ]
  },
  "signals": {
    "emotions": [
      "可直接確認的情緒線索有限；僅有一則詩性文本呈現抽離、惋惜與離別意象。"
    ],
    "relationship_patterns": [
      "出現個案專屬稱呼與情感文本，但上下文不足。"
    ],
    "work_patterns": [
      "持續校準 in spirit / TruthOS 的系統定位與啟動語言。",
      "關注登入 session、身份映射與稱呼一致性。"
    ],
    "decision_patterns": [
      "偏向先釐清定義、身份與系統邊界，再推進後續內容。"
    ]
  },
  "truth_mapping": {
    "dimensions": [
      {
        "code": "discernment",
        "score": 0.84
      },
      {
        "code": "cognition",
        "score": 0.79
      },
      {
        "code": "relationship",
        "score": 0.46
      }
    ],
    "principles": [
      {
        "code": "DRF_CAND_001",
        "title": "先分清事實、詮釋、推論，再談真理判斷",
        "confidence": 0.84
      },
      {
        "code": "COG_CAND_001",
        "title": "命名一旦錯位，互動定位就會跟著偏移",
        "confidence": 0.76
      },
      {
        "code": "DIS_CAND_002",
        "title": "系統定位越清楚，使用依賴越不容易生成",
        "confidence": 0.79
      },
      {
        "code": "REL_CAND_001",
        "title": "情感素材可以是入口，但不能代替脈絡本身",
        "confidence": 0.62
      }
    ],
    "puzzles": [
      {
        "id": "puzzle_identity_mapping_gap",
        "title": "登入身份與稱呼映射落差",
        "pattern_type": "identity-mapping",
        "confidence": 0.82
      },
      {
        "id": "puzzle_system_positioning_boundary",
        "title": "系統定位需要反覆被釐清",
        "pattern_type": "discernment-boundary",
        "confidence": 0.8
      },
      {
        "id": "puzzle_sparse_context_emotional_material",
        "title": "情感素材存在，但脈絡不足",
        "pattern_type": "partial-context",
        "confidence": 0.61
      },
      {
        "id": "puzzle_discernment_over_completion",
        "title": "寧可承認不知道，也不把空白補滿",
        "pattern_type": "truth-discipline",
        "confidence": 0.88
      }
    ]
  },
  "recommended_actions": [
    "對需要長期追蹤的個案，建立前一日事件／情緒／決策三欄式輸入。",
    "優先修正登入身份與稱呼映射的來源規則。"
  ],
  "recommended_questions": [
    "你最近最想避免的，是被誤解、被簡化，還是被錯誤代言？"
  ],
  "truth_observations": [
    "本次最穩定的真理治理動作，不是多做解釋，而是維持事實與推論邊界。"
  ],
  "writeback_candidates": {
    "soul_map": {
      "recurring_patterns": [],
      "limiting_beliefs": [],
      "emotional_signatures": [
        "資料不足，僅見低信心的抽離／惋惜文本線索"
      ],
      "active_lessons": [
        "先校準命名、身份、來源，再談更深生命判讀"
      ],
      "evolution_stage": "observation_only",
      "should_write": false
    },
    "blind_spot_archive": [
      {
        "title": "命名映射可能干擾互動定位（觀察中）",
        "trigger_pattern": "登入身份與稱呼不一致時出現校準需求",
        "known_theory": "知道系統應依登入或 session 身份正確映射稱呼",
        "practical_failure_mode": "目前只觀察到落差事件，尚無反覆理論—實作失配證據",
        "suggested_anchors": [
          "先確認身份來源優先序",
          "把稱呼映射視為互動治理的一部分"
        ],
        "related_puzzles": [
          "puzzle_identity_mapping_gap"
        ],
        "should_write": false
      }
    ],
    "belief_logs": [
      {
        "belief_before": "資料不足，尚無法確認穩定舊信念",
        "belief_after": "資料不足，尚無法確認新信念形成",
        "tag": "insufficient-evidence",
        "evidence": [
          "目前未見明確 before/after belief shift"
        ],
        "related_dimension_code": "discernment",
        "related_principle_code": "DRF_CAND_001",
        "should_write": false
      }
    ],
    "case_summary": {
      "title": "身份辨識與系統定位校準中的觀察性摘要",
      "summary": "近 72 小時可見脈絡顯示，使用者正聚焦於系統身份、命名映射與平台定位的校準；情感素材存在，但不足以下定論，適合作為觀察性 case summary 候選而非定案。",
      "related_dimensions": [
        "discernment",
        "cognition",
        "relationship"
      ],
      "should_write": true
    }
  },
  "dashboard_metrics": {
    "clarity_score": 58,
    "emotional_intensity_score": 34,
    "alignment_score": 71,
    "boundary_score": 88,
    "truth_discernment_score": 90,
    "memory_confidence_score": 41
  },
  "uncertainty_notes": [
    "24 小時觀察窗內容不足，因此已擴展到 72 小時。",
    "缺少工作區近兩日 memory 檔，導致事件時間線與情緒細節稀薄。",
    "目前未提供生命心法附件或可讀連結，因此本次僅能根據現有對話與記憶脈絡整理，不能補想、不能虛構、不能假設其內容。",
    "目前沒有足夠證據支持 soul lesson、karmic pattern、life blueprint 等高階結論；若提及，只能作為工作假說。"
  ],
  "source_context_status": {
    "life_principles_attached": false,
    "external_context_complete": false,
    "missing_inputs": [
      "生命心法附件或可讀連結",
      "2026-03-13 memory 檔",
      "2026-03-14 memory 檔",
      "個案文本上下文",
      "過去 24h 明確事件／情緒／決策記錄"
    ]
  }
}