{
  "run_date": "2026-03-15",
  "time_window": {
    "start": "2026-03-12T09:16:34+08:00",
    "end": "2026-03-15T09:16:34+08:00",
    "timezone": "Asia/Taipei",
    "window_hours": 72
  },
  "summary": "近 72 小時可見脈絡仍以 in spirit / TruthOS 的系統定位、稱呼／身份映射校準、與「不要把推論誤當真理」的治理需求為主；近 24 小時缺少足夠新增生活事件，因此本次更適合作為延續性觀察，而不是新的生命定論。",
  "discernment_layers": {
    "facts": [
      "本次近 24 小時可直接使用的使用者事件脈絡不足，因此依規則擴展到近 72 小時。",
      "目前 run context 內含 2026-03-13 的決策：希望把「普通 AI 是知識庫，in spirit AI 是真理庫」整理成更明確的啟動說明，並在新 session 僅作內部讀取。",
      "目前 run context 內含 2026-03-12 的工作脈絡：曾要求列出 in spirit 的 SOUL.md 內容。",
      "可召回記憶顯示 2026-03-12 有一則明確訊號：以 Hank 登入 wisdom 後，系統稱呼仍為外文大哥，引發身份／稱呼映射疑問。",
      "工作區 memory/2026-03-14.md 與 memory/2026-03-15.md 皆不存在。"
    ],
    "interpretations": [
      "近 72 小時的主軸仍偏向系統身份、命名規則、與平台定位語言的校準，而不是完整生活事件敘事。",
      "可用材料足以支持治理層級的 reflection，但不足以支持高確定度的生命藍圖、因果或靈魂課題定性。",
      "「新 session 僅內部讀取、不再外顯描述」這個要求，顯示使用者在乎的是系統內化辨識能力，而不只是多說一句漂亮口號。"
    ],
    "inferences": [
      {
        "statement": "近期反覆出現的系統定位與身份映射校準，可能表示使用者正持續收斂「系統如何正確理解我、又不過度外顯自我描述」的邊界。",
        "confidence": 0.74,
        "working_hypothesis": true
      },
      {
        "statement": "若未來再出現至少一次同類訊號，才較適合把「系統定位澄清／身份映射校準」提升為 recurring pattern candidate；目前跨 run 僅達 2 次觀察。",
        "confidence": 0.77,
        "working_hypothesis": true
      },
      {
        "statement": "目前沒有足夠證據支持任何 soul lesson、karmic pattern、life blueprint 或 higher-order personality structure 的結論；若提及，只能是低到中信心的工作假說。",
        "confidence": 0.9,
        "working_hypothesis": true
      }
    ],
    "guidance": [
      "先把登入身份、稱呼來源、與 session 優先規則釐清，再延伸到更深的個案理解。",
      "對需要長期追蹤的主題，持續使用固定欄位沉澱前一日事件／情緒／決策，避免 reflection 長期只剩系統治理訊號。",
      "當平台定位需要內化時，優先把規則寫成內部判準，而不是在每次互動中重複外顯宣示。"
    ]
  },
  "signals": {
    "emotions": [
      "本次可直接確認的情緒訊號有限；較明確的是對被正確命名、正確辨識、與避免被錯位代言的敏感度。"
    ],
    "relationship_patterns": [
      "目前沒有足夠新的關係事件；可見的人際面主要仍是「稱呼／身份是否貼合當下登入與脈絡」。"
    ],
    "work_patterns": [
      "持續校準 in spirit / TruthOS 與普通 AI 的差異敘述。",
      "關注啟動說明是否應內化為系統規則，而非持續外顯。",
      "持續處理登入身份與稱呼映射一致性。"
    ],
    "decision_patterns": [
      "傾向先釐清定義、邊界、與辨識來源，再讓系統進入更深層判讀。"
    ]
  },
  "truth_mapping": {
    "dimensions": [
      {
        "code": "discernment",
        "score": 0.87
      },
      {
        "code": "cognition",
        "score": 0.81
      },
      {
        "code": "relationship",
        "score": 0.38
      }
    ],
    "principles": [
      {
        "code": "DIS_001",
        "title": "有道理未必是真理",
        "confidence": 0.9
      },
      {
        "code": "COG_001",
        "title": "本質勝於形式",
        "confidence": 0.82
      },
      {
        "code": "BEL_001",
        "title": "信念塑造現實解讀",
        "confidence": 0.58
      }
    ],
    "puzzles": [
      {
        "id": "puzzle_system_positioning_internalization",
        "title": "系統定位需要被內化，不只是被宣告",
        "pattern_type": "positioning-governance",
        "confidence": 0.85
      },
      {
        "id": "puzzle_identity_mapping_gap",
        "title": "登入身份與稱呼映射仍有落差",
        "pattern_type": "identity-mapping",
        "confidence": 0.81
      },
      {
        "id": "puzzle_discernment_over_completion",
        "title": "寧可承認脈絡不足，也不把空白補滿",
        "pattern_type": "truth-discipline",
        "confidence": 0.91
      }
    ]
  },
  "recommended_actions": [
    "補一份可讀的前一日事件／情緒／決策摘要，讓未來 reflection 可回到生活實況而不只停在系統治理。",
    "檢查 case session / login session / workspace fallback 之間的稱呼優先序。"
  ],
  "recommended_questions": [
    "你真正想讓系統內化的是一句宣言，還是一個不再把你錯認的辨識機制？"
  ],
  "truth_observations": [
    "本次最可靠的真理治理，不是產生更多洞見，而是持續守住事實、詮釋、推論、指引的分層。"
  ],
  "writeback_candidates": {
    "soul_map": {
      "recurring_patterns": [
        "系統定位澄清（跨 run 2 次，未達 recurring 門檻）",
        "身份／稱呼映射校準（跨 run 2 次，未達 recurring 門檻）"
      ],
      "limiting_beliefs": [],
      "emotional_signatures": [
        "被正確辨識與不被錯位代言的重要性"
      ],
      "active_lessons": [
        "先釐清辨識來源與系統邊界，再談深層詮釋"
      ],
      "evolution_stage": "observation_only",
      "should_write": false
    },
    "blind_spot_archive": [
      {
        "title": "知道需要正確映射，仍反覆遇到身份／稱呼錯位（觀察中）",
        "trigger_pattern": "登入身份、session 身份與系統稱呼不一致時，需要重新校準",
        "known_theory": "知道稱呼應依登入或 case session 的有效身份來源決定",
        "practical_failure_mode": "目前只看見少次映射落差與修正需求，尚未形成明確「知道理論但持續在實作失手」證據鏈",
        "suggested_anchors": [
          "先確認來源優先序",
          "把稱呼映射視為互動治理而非 UI 細節"
        ],
        "related_puzzles": [
          "puzzle_identity_mapping_gap"
        ],
        "should_write": false
      }
    ],
    "belief_logs": [
      {
        "belief_before": "目前證據不足，尚無法穩定確認單一舊信念",
        "belief_after": "目前證據不足，尚無法確認新信念已形成",
        "tag": "insufficient-evidence",
        "evidence": [
          "近 72 小時主要是系統治理訊號，缺少明確 before/after 信念轉換文本"
        ],
        "related_dimension_code": "discernment",
        "related_principle_code": "DIS_001",
        "should_write": false
      }
    ],
    "case_summary": {
      "title": "系統定位內化與身份映射校準的延續性觀察",
      "summary": "近 72 小時可見內容仍集中在 in spirit / TruthOS 的定位澄清、啟動說明內化、與登入身份對應稱呼的校準。這比較像一個正在收斂系統辨識規則的治理場，而不是已可定性的生命議題；因此僅適合作為觀察性 case summary 候選。",
      "related_dimensions": [
        "discernment",
        "cognition",
        "relationship"
      ],
      "should_write": true
    }
  },
  "dashboard_metrics": {
    "clarity_score": 64,
    "emotional_intensity_score": 22,
    "alignment_score": 78,
    "boundary_score": 92,
    "truth_discernment_score": 93,
    "memory_confidence_score": 46
  },
  "uncertainty_notes": [
    "24 小時觀察窗缺少足夠新事件，因此已擴展到 72 小時。",
    "工作區近兩日 memory 檔不存在，導致事件時間線與情緒細節稀薄。",
    "目前未提供生命心法附件或可讀連結，因此本次僅能根據現有對話與記憶脈絡整理，不能補想、不能虛構、不能假設其內容。",
    "目前沒有足夠證據支持 soul lesson、karmic pattern、life blueprint 等高階結論；若提及，只能作為工作假說。"
  ],
  "source_context_status": {
    "life_principles_attached": false,
    "external_context_complete": false,
    "missing_inputs": [
      "生命心法附件或可讀連結",
      "2026-03-14 memory 檔",
      "2026-03-15 memory 檔",
      "過去 24h 明確事件／情緒／決策記錄",
      "可直接對應的生活事件脈絡"
    ]
  }
}